Summary,vader_neg,vader_neu,vader_pos,vader_compound,roberta_neg,roberta_neu,roberta_pos,Rate
"We used SQ  875 from Hong Kong to Singapore for transit  and SQ 964 from Singapore to CGK international airport in Indonesia, This is used to be the best Airlines. First of all it was delayed for 3 hours at the Hong Kong Airport with no air conditions in the mid of Summer in Hong Kong. The AC was on after the plan started to move. This delayed cause us to missed our connecting flight in Singapore. Arrive in Hong Kong again we had to wait inside the airplane for 45 minutes due to technical problems again with no air conditions. Now because of that we are booked on the next flight in which of course being 2 hours late, it is a good thing that are in side Changi Airport. The airport is not that great like people saying. Hong Kong new airport and Doha international airport is way better than Changi. I have to tell you about this airport too. Now after being 2 hours late they told us to go to Gate 69 in which we wait patiently with the other passenger and crew. Long behold on the boarding time, a staff came and spoke to the crew and the crew announced that the gate was changed to Gate 29. That is a 40 mins walked with no official announcement. By the way at Gate 29 it will still say SQ  964 and the official airport announcement  board is still on Gate 69. This is the worst airlines experience that we had, this is way worst than Lion Air or Pakistan International Air. Singapore Airlines make these airlines looks way better. So we cancelled our return flight and only got 50% back after all of the fine, currency exchange etc even though we cancelled it 3 weeks before our returned flight. I recommended Avoid using Singapore Airlines at all cost. We changed to Cathay Air from CGK to HK and its a very nice experience with cheaper ticket price with a wonderful crew and better meal. Again Do Not use this airlines, you will regret it.",0.102,0.829,0.069,-0.8507,0.36345019936561584,0.4071796238422394,0.22937019169330597,1
"We were looking forward to our flight with Singapore Airlines last month. We had booked 2 business class tickets online for our departure from Sydney with a cancellation fee of $330 each.

Unfortunately my wife was suddenly diagnosed with a major illness & had to cancel our flights 2 weeks before departure.

I submitted the online cancellation with a copy of the oncologist report and scans. I received the full refund & waived the cancellation fee within 4 business days. Excellent service from the Singapore Air administration team.

Thank you  Singapore Airlines for the outstanding customer service.

",0.072,0.824,0.104,0.6249,0.1386818140745163,0.2872733771800995,0.5740448236465454,5
"The service was excellent. Very impressed to see Singapore Airlines continuing to be one of my favourite airlines to travel with. The meals were excellent, inflight entertainment was excellent, and the cleanliness in the washrooms were perfect on both of my flights. It is always wonderful travelling with Singapore Airlines and will always continue to use the airline for future travels! Way to go Singapore Airlines!",0.0,0.7,0.3,0.9783,0.0015088755171746016,0.0065828897058963776,0.9919082522392273,5
"We had the worst experience with Singapore Airline. We booked a flight on January to go to South Africa to visit our family, everything was good until my husband had an accident and had to have a major surgery 4 days before our flight, therefore it was medically impossible for us to travel. 
We first contact Singapore Airline and they told us that as it was a medical emergency, it was not a problem for us to change our flights later on when we have a date, so they cancel our ticket.
After a few weeks, we contact them again and a different person answered the phone telling us that we could not possibly change our flights as we had booked through an agency, and we need to now contact the agent. 
The agent has already informed us that they could not possibly help us as this was a policy of the airline and we needed to contact them directly.
It has been almost 4 months and lots of hours in the phone, and we still haven't managed to change our flights!
We are very disappointed as we paid for our tickets and are not cheap! We were not asking anything for free we just wanted our flights to be changed or our money to be reimbursed!",0.083,0.88,0.038,-0.8792,0.8788183927536011,0.10847289115190506,0.01270877942442894,1
"Disappointed with SQ ground service. I accidently left my water bottle at SQ 956 seat number 17A on August 2. I have reported the case directly online with case number SQFP030823039727 after several attempts to contact the SQ customer service LA/SING/JKT.

Today August 12th, 10 days after, no one following up my case, no email, no phone call, no nothing!! what ashamed",0.179,0.747,0.074,-0.809,0.9550443291664124,0.041726354509592056,0.0032294050324708223,1
"Definitely not the best airline and I wouldn't consider it to be anywhere in the top class.

Absolutely the worst experience one could imagine. Toilets were disgusting and dirty. Staff were unpleasant and not very friendly. Seating is basically on top of each other so you can't eat. I would highly recommend you utilize another airline for the amount of money you pay. ",0.266,0.621,0.113,-0.9231,0.9730265736579895,0.023321693763136864,0.0036516641266644,1
"Lousy help desk at Terminal 3. I flew in from Brisbane. Went to the connecting help desk. She couldn't even tell me which terminal I landed and which terminal my connecting flight is from. 
The business class didn't even have a choice of food. Only vegetarian. This us after paying $8000 for the trip. ",0.062,0.844,0.095,0.2263,0.9144189357757568,0.07532524317502975,0.010255812667310238,1
"Was expecting better from Singapore airlines but premium economy is nothing besides a bigger seat. Food was just ok, No amenities kit, not a great selection of entertainment. The poor passenger in front of me had a seat that wouldn’t recline. Overall it was not worth the price. Definitely have had better experience with other airlines. Only saving grace was the ground staff and flight attendants were wonderful. ",0.146,0.587,0.267,0.9044,0.17885279655456543,0.3008587658405304,0.5202884674072266,2
Our experience with this airline was unmatched on our trip. The staff were attentive and lovely. We were in economy and had plenty of room. We didn't feel we needed to upgrade (which we felt on other airlines). The experience was wonderful and I couldn't recommend them enough.,0.063,0.798,0.139,0.7261,0.003291195258498192,0.01033319067209959,0.986375629901886,5
"Every time I fly on Singapore Airlines my experience is excellent. 

The quality of service, food, entertainment system, & cleanliness all, in my experience, make it the best airline in the world.",0.0,0.716,0.284,0.8934,0.0018659494817256927,0.014116499572992325,0.984017550945282,5
"I have used this carrier on several trips and three of the last four the flights the inflight entertainment was broken and food only average. I was offered a voucher for the entertainment stuff up, but on a seven hour flight with children, noise cancelling would have been a god send. The flight was also late with embarkment some what. Shambles 
They had the hide to offer us economy seats to move to watch movies when half of business was empty. 
After so many time of poor service I will choose another carrier from now on. I don’t know how they continue to rate so high with expectation.

Tip. Don’t bother asking for upgrade it won’t happen.",0.128,0.82,0.052,-0.8519,0.8826372027397156,0.10214556008577347,0.015217202715575695,2
"Firstly, the staff on the plane were fantastic and helpful. I have no complaints for them.
The complaints all come from the company itself. It used to be a luxury airline to fly with. Now they have gone the same way as British Airways and become a disappointment. 
No over-ear head phones, just little cheap buds that are difficult to hear with. The food is really cheap and bad.
Boarding happens from only the front of the plane. They let business board, then after a few minutes they let economy board walking straight passed their not so private business seats.

I highly suggest avoiding Singapore Airways now and take a cheaper flight.",0.176,0.758,0.066,-0.9143,0.712817370891571,0.22002145648002625,0.06716115772724152,1
"What a wonderful experience with Singapore airlines , although the stewards were working very hard keeping me and the rest of the passengers happy nothing faced them
Well done",0.103,0.678,0.218,0.7089,0.003062559524551034,0.014937201514840126,0.9820001721382141,5
"My previous experience three weeks earlier was a little bit disappointing (BOM-SIN-BKK), however, there were two excellent flights this time: SQ707 BKK-SIN on 26 July and SIN-BOM 31 July. The crew on the SQ707 on 26 July were  exceptional (IFM Geradine, LSS Jane, FSS Gift, FSS Moon & FS Arif), wanted to get their names since great and dedicated work must be recognized.

As already said, superb crews on both flights, excellent lunch/dinner, and flights on-time. The only gripe is that I don't seem to get a comfortable position on the B777-300ER: the angled position is quite awkward and my back hurts after two hours - prefer the A350 over the B777-300ER. This, of course, is a matter of personal taste only.",0.057,0.756,0.187,0.9583,0.1659170687198639,0.3529745042324066,0.4811084568500519,5
"Flew with Singapore Airlines with my fmaily members of total 2 adults and 2 kids and this time sitting at Economy Class.

I am expecting the usual great service, smile and courtesy with reasonable food but I am rather disappointed as compare to those reviews that I read. The male steward, I guess the supervisor (as seems older than everyone), just like a robot and does not have expression on his face when offering service to the passenger. In fact it is close to ""does not care"" kind of attitude.

Food, just so so

Entertainment is the only thing good about this flight.",0.066,0.771,0.163,0.8751,0.493958443403244,0.32524120807647705,0.18080024421215057,2
"Very disappointed and I will never use their economy class. They are using ""sustainability"" as an excuse to cut down any services like an amenity pouch (They will give you only if you ask for it,  rather than provided on your seat like other airlines). The food is just average, served in the same presentation as economy even you select meals from Book the Cook. Toilet is shared with economy passenger so very crowded and dirty.  In-flight snacks are carefully hidden and guarded in galley that you need to ask what you want to cabin crew rather than enjoying selection.  I will take Emirates or Qatar next time. No more SG.",0.088,0.792,0.12,0.2601,0.9207092523574829,0.07087535411119461,0.008415449410676956,1
My upgrade to business class due to a missed connection proves again that SQ is my favourite airline. The special treatment was very much appriciated.,0.082,0.818,0.1,0.128,0.004293651320040226,0.031706444919109344,0.9639999270439148,5
"Just the perfect experience, and in my favourite aircraft (A350)! If something could be said that maybe not all like is that the ""style"" of the interior design of SA might become a bit all-too-classic, thereby dated. But this is just a visual thing and let's not discuss about colours and so! And, indeed, with a set-up that 4 seats (1-2-1) over the width of the aircraft are present as compared with the 6 seats (2-2-2) for the same class and aircraft with e.g., Lufthansa, it is more than clear that the privacy space and the size of the bed for the night is EXCELLENT!",0.014,0.867,0.119,0.9279,0.011885931715369225,0.10474018007516861,0.8833739161491394,5
If you are a vegetarian pl avoid Singapore airline . They will starve you . Emirates like airlines understands better . You get same food and you envy  the non veg eaters . Plus some of the staff mouth hygeine is bad ,0.227,0.658,0.115,-0.6486,0.8836004734039307,0.10546967387199402,0.010929807089269161,4
"How this airline wins any awards for ANY aspect of its service is beyond me. Flights delayed, bags lost, completely incompetent customer service. I can track my pizza delivery down to the last km, but Singapore Airlines cannot tract a bag, if you have a choice, don’t book this airline. Emirates are so far ahead of these guys in every single aspect, it’s hard to believe how they survive. Nice friendly cabin crew, that’s where it ends. Let’s see if our bags turn up today ??",0.073,0.793,0.134,0.8322,0.7031910419464111,0.22573645412921906,0.07107248157262802,1
"Our flights were rescheduled a few weeks ago which left us with only an hour to transit in Frankfurt. Yee Yang, ably supported by his seniors Aminah and Kyi, did everything he could to make sure we could make the connection - including requesting for our Munich transfer boarding passes to be waiting for us at Frankfurt 

Whether or not we make the connection, we appreciate the thoughtfulness

Thanks Yee Yang, Aminah, Kyi",0.0,0.834,0.166,0.9022,0.005414958111941814,0.13041682541370392,0.8641682267189026,5
Singapore airlines cancelled our flight from Copenhagen to Reykjavik and offered a refund we accepted a refund and were led to believe this was happening and now we are being ignored this company is a corporate bully a law unto itself not accountable and you are powerless don't give them your money,0.192,0.771,0.038,-0.8225,0.9513296484947205,0.04599423706531525,0.002676103264093399,1
"Our flight was delayed and they made us wait in the plane for 5 hours. There was a time for about 30 mins to 1 hour wherein there was no light and air conditioner inside the plane. They made us embark to the plane and gave us food stamps. The thing is, we had an another flight from another airline and we made sure to have a 6 hours layover when we arrived to the final destination.  But since we were delayed we didn’t get to take the plane. We asked about our situation while we were at our stopover if we ever missed our flight because of the delay they told us that when we get there (the final destination) if we ever have to take the next plane the next day they will give us a full accommodation. But, when we got to the final destination they denied us and told us that they can’t do anything about it and that we have to pay for our own and ask the other airline. Luckily, the other airline rebooked us for the latest flight that we could get which is tomorrow noon. I just feel really disappointed of how things went.",0.1,0.871,0.029,-0.92,0.7304925918579102,0.2382163554430008,0.031291086226701736,1
By traveling Singapore airlines is my worst experience all my travel history.  I never experience such uncomfortable business class seats the bed is so hard while traveling i developed pain in my back there is no space to straight your legs one has to sleep on a angle i could not sleep in my journey.  There is very limited menu for the food specially for a vegetarian.  The Delhi Singapore staff is rude and service is very bad. I want Singapore airlines should refund my fair.  This my first and last time traveling in Singapore airlines.  Will never travel or recommend any one. Raghu vyas well known imaginary realism painter in India. ,0.18,0.74,0.08,-0.926,0.9606876969337463,0.03535189479589462,0.003960460424423218,1
"Had the most horrific dealings with Singapore airlines check in manager at Changi airport, firstly my wife is registered as disabled and my wife and i are both in our 60's.
We booked extra legroom seats because of my wife's disability and returned from Singapore to London Heathrow on flight SQ306 on Monday 29th May 2023, we had a really upsetting and stressful experience after we boarded the flight, this was also witnessed by the cabin crew who have submitted a separate report by leading steward Benjamin Khoo.
The problem was caused by the boarding gate manager in Singapore, we boarded at gate 9.
The first issue was that the seats we had booked were 31A and 31C in premium economy were emergency exit seats and we were told that we would have to be moved because of my wife's mobility issues, this was fine and we were allocated seats 32H and 32K, we were taken to the gate (my wife in a wheelchair) and boarded with no issues and got settled into our seats for the long 13 hour flight home.
Obviously the people who were originally in the seats that we moved to were offered the free upgrade for the extra legroom seats we had originally booked, this is where the problems started.
One of the passengers ( a male in his late 20's early 30's  )who was moved was not happy with the free upgrade and there was obviously a lot of discussions taking place which we could witness from where we were seated but did not know the content of, eventually the check in manager entered the plane ( the same man who gave us our new seats ) and after a few minutes of talking to the man in his 20's / 30's came over to where we were now settled and said that the man was not happy with his new upgraded seat and wanted his original seat back, he ordered us to move to seats 33F and 33G which were middle aisle seats, i told the manager that my wife needed to get up and move around to stop her seizing up, but he was not interested and said move or he would have us escorted from the plane, he was extremely rude and arrogant and was not interested in my wife's disability and the pain it then caused her to move again, he was more interested in letting a fit and able young man have his original seat back. this exchange was witnessed by multiple passengers and crew, the lady who was moved with this young man was not happy either and would have been happy to stay in her upgraded extra legroom seat, if this is the quality of management that Singapore airlines wish to employ we will never travel with Singapore airlines  again, this man has single handily destroyed my faith in Singapore airlines.
The stewards on the plane were very sorry for what they had witnessed and truly did all they could to try to make up for what had happened but ultimately this check in manager represents the whole of Singapore airlines and this individual had no concern or care for my wife's disability, my wife was extremely upset and we both felt stressed and anxious by this extremely unpleasant experience and would like to think that some form of action be taken against the manager that caused this issue. 
I emailed Singapore airlines on our return and received a reply which blamed the crew on the plane, i replied telling them the facts again but received no reply, i have tried contacting Singapore airlines a few times and have given them plenty of time to reply but now is the time to tell the world just how Singapore airlines deal with disabled passengers.
Finally, i was promised a refund for the upgraded seats we had paid for but have still not received anything, my next email will be to the AviationADR as Singapore airlines clearly do not care about disabled passengers",0.113,0.827,0.06,-0.9889,0.6958146095275879,0.2706584930419922,0.03352692350745201,1
"We flew from Sydney to Penang on Singapore Airlines and it is easy to see how they keep winning so many awards. Easy check in via the automated kiosk system, boarding was simple on both flights and the flight itself was great. The staff are helpful and very friendly. Both flights were on very comfortable aircraft (A350 & B738MAX) and overall it was a great experience and a wonderful start to a three week trip.",0.0,0.639,0.361,0.9878,0.0012673315359279513,0.009360838681459427,0.9893718361854553,5
"CHECK  your charges! Was supposed to be charged X amount and ended being charged extra $140 AUD. I emailed SIA to credit the difference but after 2 months of emails and investigation of the problem, they said it is my bank's fault. I contacted my bank and they replied within one day to say that it is indeed SIA putting through the extra charges. I emailed the reply from my bank to SIA  and SIA has stopped replying. I am so disappointed. Why is it so hard to get good customer service these days? My bank has advised me to initiate a dispute in the transaction and initiate a chargeback but this was not the desired outcome i wanted. Customers are just not looked after anymore these days. So disappointed and appalled at SIA customer service!",0.256,0.708,0.036,-0.987,0.9593725800514221,0.036804258823394775,0.003823119681328535,1
"4th July 2023

As we boarded The flight from Delhi to Singapore, we were told that all the seats of Business Class the Seat power is not working. It means that the seat functions like Recline, lie flat, seat USB power, Seat controls nothing would work.

Further, the inflight entertainment for entire flight was faulty and not working.
We had a bad experience for the 5 hour long day flight.",0.077,0.852,0.071,-0.128,0.9484053254127502,0.047236789017915726,0.004357896279543638,3
"I had a disappointing experience contacting Singapore Airlines Customer Call Centre. I had to contact them on regarding my concern related to my flight. I called in to change my flight date and it was 3 months in advance.

There was constant background noise, making it extremely difficult to communicate with the agent. It felt like I was in a night market with the background noise of other calls.

I hope Singapore Airlines will quickly address this problem and make improvements to their call center operations, ensuring a better and smoother customer service experience for all passengers.",0.09,0.786,0.125,0.3781,0.7952542304992676,0.17265859246253967,0.03208712488412857,2
"I recently had a disappointing encounter with Singapore Airlines' contact center that left me dissatisfied. My intention was to seek assistance regarding a flight booking issue, but the experience was impaired by faulty equipment and communication system on their end. 

Upon calling, there were crackling noise in the background. It seemed as though there was a significant issue with their communication system or headset quality. Despite my efforts to communicate my concern, the representative's voice often faded in and out, causing immense frustration. This hinder our communication and my concerns were hard to address smoothly causing immense frustration. ",0.158,0.821,0.021,-0.9267,0.9682726860046387,0.02905060350894928,0.002676790114492178,2
"My girlfriend has coeliac so she needs gluten free meals. She is also vegetarian. 
Unfortunately singapore airlines cannot cater for gluten free meals that are also vegetarian. 
They are also unable to give us complete list of indgredients of the meals, so there is no way we can’t check ourselves. When we call customer service they are unable to call kitchen or re-clarify list of ingredients on the menu. 
For some reason they assume that if you are coeliac you can’t be vegetarian. 
So disappointing especially by its customer service as they can’t help with my simple queries of list indgredients on the menu. Thumbs down.",0.071,0.85,0.079,0.2366,0.9176176190376282,0.07457763701677322,0.007804745342582464,1
"We booked return business class flights to Europe on flexible tickets.

It was then necessary for us to change the Sydney Paris leg to Sydney Istanbul on a later date.
The ticket conditions stated ""Booking change fee Complimentary (a fare difference may apply)"" . We expected this fare difference condition to be applied in good faith.

Singapore Airlines imposed a 30% penalty for this change.

I questioned the Singapore Airlines staff on this 30% penalty in two regards

Firstly, we were changing to a shorter, cheaper flight, why was the cost increasing?
* Flight Time for Singapore Paris is 13h 35m.
Flight Time for Singapore Istanbul is 11h 0m
* The fare for Sydney Paris is AUD7792.39-8217.25
The fare for Sydney Istanbul is AUD 6342.59 at the time we proposed the change to the booking.

Secondly, part of this change is that an airfare Singapore Paris on 26 Aug is now made available for sale by Singapore. The price of this fare is higher than the Istanbul fare which would be taken off the market by our change. So as well as charging an extra 30% for the outward bound leg of our journey, Singapore profit further by the higher sale price of that Paris fare. Singapore may well say that they might not sell this fare. Perhaps, but they also may not sell the Istanbul fare.

Despite interactions with many many Singapore Airlines staff, not one person ever answered the issues raised, or in any way ""owned the problem""

To make matters worse the Singapore Airlines representative proudly told me there was ""no penalty"" for the change in booking. In such case why the 30% charge for changing to a cheaper flight ?

So while I understand “revenue maximisation models” I also understand concepts of acting in good faith with customers. How does this latter concept factor in their penalty ? Singapore Airlines talks with pride about the experience it provides to people who fly with them. The process we are going through now is part of that experience. All we were looking for is that people act in good faith and with fairness.

These practices should really be reviewed by Australia's consumer protection authorities. The statement ""Booking change fee Complimentary (a fare difference may apply)"" is clearly grossly misleading. That should be our next step.",0.073,0.822,0.106,0.9189,0.5026800036430359,0.43779653310775757,0.05952344462275505,1
