Summary,vader_neg,vader_neu,vader_pos,vader_compound,roberta_neg,roberta_neu,roberta_pos,Rate
"Just completed the 18 hour+ flight from Newark International Airport to Singapore. I have travelled from the States to Singapore many times, but have previously flown via United from Newark to San Francisco, and then SFO to Singapore. I decided to try the nonstop flight just to have the experience. Overall, it was as good as an 18- hour flight can be. Sitting in business class with the flat-bed seats was certainly worth the cost. The food was delicious and the movie selection was outstanding. I watched five movies (all recent releases), and as a result was throughly entertained for the first 9-10 hours of the flight. When I finally decided to go horizontal, the flight attendant helped to convert the seat into a bed and I was reasonably comfortable; my only complaint is that the flat bed configuration requires that you sleep on an angle, and there isn't a lot of room to maneuver on the bed. When you want to switch positions, you feel like you are on a rotisserie. However, the plus factors greatly outweigh the inconvenience of not being able to truly sleep comfortably when you are a very tall person. I also like the fact that the flight arrives into Singapore about 5:00pm, and during the summer--this is a plus (at least for me), since it is still daylight in Singapore and I felt that I had a few hours to be active before I crashed.  I don't think I will ever say that I am looking forward to a 18-hour nonstop flight, but if you have to fly from the US east coast to Singapore, it is the best way to go.",0.021,0.793,0.186,0.9946,0.0203123576939106,0.11935348063707352,0.8603341579437256,5
"Very slow and poor customer service from Singapore airlines. i flew from Johannesburg to Bangkok on 20/05/2023. upon arrival, i notice my luggage was damaged (the bottom of my bag was broken and the wheel broke off). I immediately contacted Singapore airlines for assistance. they replied with several different emails requesting documentation and pictures which i sent. I am flying back to Johannesburg tomorrow (29/05/2023) without a bag i can use for my luggage. Ive indicated the urgency to Singapore airlines but theres absolutely no regard for this. I will definitely not be flying with Singapore airlines again because of this poor service. The disregard is unbelievable. i will also be informing my company and other companies in our network to not use Singapore airlines for any of our staff going forward. I never expected this type of service from what i thought was a reputable company

Thank you",0.12,0.822,0.058,-0.8185,0.9434646368026733,0.05084872245788574,0.0056866975501179695,1
"Singapore airlines have always been our preferred overseas airline based on the quality of service and especially their food quantity. We travelled to and from Melbourne to Phuket via Singapore, 4 flights and did not enjoy any of the food served on the flights. Based on what we saw, we were not alone in returning meal trays barely touched. Surely this should tell the catering staff to lift their game.",0.036,0.904,0.06,0.1861,0.36698755621910095,0.4216425120830536,0.21136988699436188,3
"We booked and paid 11 months in advance so that we could get the seats we wanted, and pre-paid for extra legroom seats.  Even though the aircraft type has not changed, Singapore airlines moved our seats without permission.  I would bet good money that they did so for greed, and no other reason.  Unless you want the same thing to happen to you, consider flying another airline.  No more business for Singapore Airlines from us.",0.092,0.856,0.052,-0.4902,0.5733224153518677,0.363647997379303,0.06302960216999054,1
"I was flying from LAX to Singapore on Business Class on flight DQ 037 on 24 May 2023. 
Did not see a service attendant for the first few hours. Then dinner was served . There was no menu for choices just was given a Tray. Never saw the attendant after that. I was woken up about 8 hours into  a 18 hour flight to ask if I needed lunch. After that never saw an attendant  . The bed space was small. Never given any toiletries which most Airlines offer 
All in all Singapore Airline was a disappointment to me. Will never fly it again",0.056,0.944,0.0,-0.6705,0.8862105011940002,0.10127412527799606,0.012515425682067871,2
"Our first flight was   SQ 214   Perth to Singapore
We were disappointed with the Singapore Lounge at Perth Airport, it is extremely small, and quite dark.
The flight was nice and comfortable, the meal, the Chicken in Macadamia Nut Crust, we were very disappointed with, it was extremely  dry.

Our second flight was   SQ 026   Singapore to Frankfurt  
This flight was one of the worst I have been on.
My  Book the Cook order Roasted Lamb Rack - my Lamb Rack was one chop, a thick one, but one chop?
After eating my meal, I had a sleep. Upon waking I felt quite ill. I think it must have  been the food. Unfortunately I vomitted, all over myself. My husband called for help from the fight attendants. Two females appeared and the first question they asked me was what had I been drinking? All I had to drink on this flight was water -  if they paid attention to their customers - they should know this. I have never been so insulted in my life. I'm still so angry about this. The flight attendant came and suggested I wouldn't like to have breakfast - don't worry I wasn't going to anyway. There was no offer of any water or anything else.

Our third flight was    SQ 2062   Frankfurt to Madrid
This flight was with Lufthansa Airways. The flight was a short flight , unfortunately our luggage was held up for two days. This could not be helped by the flight crew. They could do with some help with communication. Instead the passengers were left waiting, trying to find out where our luggage was.  
 
Our fourth flight was   SQ377   Barcelona to Milan
This short flight was crewed by some of the best flight attendants we have ever come accross. We did not have any breakfast. We had eaten a big breakast in the Miro VIP Lounge. This was an excellent lounge, the food was wonderful. The staff on the plane were very attentive, and very engaging. Unfortunately the staff were changed when we got to Milan.

Our fifth flight was  SQ377    Milan  to Singapore
This flight was better than Sinapore to Frankfurt. There are some inconsistences that I would like to point out. The service my husband and I received was quite stark. He was offered bread or croissant with his breakfast, I was not. I was offered wine on boarding, he was not.    

Our sixth flight was  SQ223   Singapore to Perth
This flight suffered from the same as the flight from Milan to Singapore inconsistant service. I was also attended by the rudest gentleman I have ever encountered, he was extremely short with his attitude and would grab things out of my hand, I think this is unacceptable.  

I was so looking forward to this trip, unfortunately I was very disappointed.
I previously had two trips we had to cancel in the last five years, and I would like to thank Sinapore Airlines for the way they handled  the complete refund.
I think I was thinking the staff and service would be as exemplary as the staff handling the refunds.
I look forward to your reply.
Regards
Frances Jojart",0.119,0.794,0.087,-0.9479,0.5586167573928833,0.2990174889564514,0.14236576855182648,1
"As I was flying from Tokyo to London, I actually took four flights in May. There is a lot I love about Singapore Airlines, but it really is dependant upon where you are sitting.
On my first flight from Tokyo to Singapore, I was lucky to book a bulkhead seat. Very comfortable and I got some sleep. Unfortunately, I wasn't able to book a bulkhead seat for the lengthier trip from Singapore to London. I was in the last row of an economy cabin and although I was lucky there was no one next to me, I felt very penned in spite of the plane being an A380 - especially when the passenger in front of me reclined. I have put on a bit of weight recently - that could be why, but I didn't feel that way a few months ago when I flew with Emirates on an A380. On the plus side, the cabin crew was lovely, the entertainment system was excellent and I chose the vegetarian Indian option - everything was very tasty.

On my way back, I think I hit the jackpot! I was in the second row of economy with the no bulkhead seat in front of me. No one was in the row beside me and I slept very well. As it was a late night flight I opted for no dinner - even so the the cabin attendants were very attentive and made sure that I wasn't hungry and was well hydrated. One of the best flights ever.

Unfortunately, the trip from Singapore to Tokyo felt - again - very cramped. I was very hungry by that stage and was surprised that on a seven hour flight, there was only one meal served - which was quite later on into the flight. A snack of some kind would have been very welcome.

If I can make sure I get a bulkhead seat or fly in Premium Economy I would definitely use Singapore Airlines again. Although the stopover time in Singapore was very long, the flights were very reasonably priced. A bit of a mixed bag but the service was universally good.

But if my budget stretches I may choose Emirates next time I fly.",0.057,0.775,0.168,0.9933,0.049501724541187286,0.19097183644771576,0.7595264315605164,3
"I can see from the reviews that Singapore airlines is not what it used to be in terms of customer service and communication they are atrocious!
been trying to get a refund for over a year since March 2022.
1st of all they changed my flight so I said i can not use that flight tried several times on the website to comminicate about it and it was so difficult and response times up to 15 days! finally I had to go to Jakarta to a Singapore airlines office to speak to someone. They acknowledged and accepted my claim but said I can just call to make a new flight resevation at a later date. During that time trying to speak to someone over the phone was impossible. Huge wait times I mean over an hour. I gave up. This year I requested a refund and I received an email saying I would get the refund within 6 weeks? this is after a year had gone by. Still waiting for the refund 6 weeks late no confirmation it had been refunded. I wrote again notifying the airline my email address had changed which I did through the Singapore airlines FF portal on the website. you have to go through a security text message to verify its you to do this. Then I get another email saying they need to verify who I am  and I need to send all the information again. OMG sooo Frustrating! Still waiting! I am wrting this review because of my frustration. I will not use this airline agian and want to warn others about my experience. This was business class flight & I am a Gold star alliance member. This is totally unacceptable as an airline and if there is a consumer complaints portal in Singapore I would love to know who to submit my complaint to about Singapore airlines.",0.084,0.854,0.062,-0.7801,0.9080916047096252,0.0826566070318222,0.009251710027456284,2
"It’s hardly surprising that Singapore Airlines ranks so highly in the world.  Their service, food and wine are absolutely tops.

First time I’ve flown with them, I’m sure I will again.",0.0,0.778,0.222,0.7717,0.004131091292947531,0.03683408349752426,0.9590348601341248,5
"I flew with Singapore Air for the first time not long before covid and was impressed by everything, seat comfort, food, movies and service. My last flight was a total disappointment. Not many movies and the food was disgusting, it was a code share flight and I couldn't even get lounge access on a 5 hour layover. Won't be in a hurry to fly again with them.",0.096,0.791,0.112,0.0258,0.7793141603469849,0.1631961166858673,0.05748963728547096,2
"Used to fly SQ for SIN-JPN route often prior to pandemic, but every aspect of the flight quality level has dropped significantly after the pandemic. Not asking for more than what economy class should be, but upset to see the economy class standard is no longer the same as before. 

Like many passengers have reviewed, no more hot towel service, a few items taken off the meal tray and reduced baggage allowance. During a recent flight back from Osaka-KIX, the meal tray really look embarrassing for a top notch airline. It was Japanese curry rice which consist of 4 very small pieces of beef cubes, 3 small cubes of potato and 2 slices of carrot, with plenty of gravy on top of an onigiri sized rice; there is a bun with butter, a packet of biscuit with cheese spread and ice cream. If cost is an issue, I guess just provide each passenger a packet of Hainan chicken rice or Nasi Lemak, which probably will look more presentable and representative of SG.",0.073,0.883,0.044,-0.7325,0.5368371605873108,0.3927997052669525,0.07036309689283371,3
"Booked online and was able to select my seat for both flights (as had a stop over in Singapore for one night) then night before leaving it was easy to check in online.  
When I arrived at airport it was quick and easy for dropping off luggage and getting through security.  
Comfortable seats, entertainment good, meals were quite good.  Similar comments for the longer leg to Milan and no problems picking up bags.",0.08,0.692,0.228,0.9186,0.005462399683892727,0.0713566243648529,0.9231809973716736,5
"Arrived at Bangkok airport after transitioning at Singapore airport. We got off the plane at Singapore to then get back on the same plane to go to Bangkok.
When we arrived at Bangkok we were greeted by someone holding up a sign with our name on it.
They then informed us that our bags were back in Bangkok.
We were told that the bags were on the next flight which would arrive at 7pm. We had to leave airport around 7pm due to a paid pickup waiting.
We were told that the bags would be delivered to the hotel.
They finally arrived at the hotel at 11.30 pm.
This meant we were awake for 24 hours , and tired.
Firstly, how can you lose a bag which should have stayed on the plane, and secondly, why did it take so long to be delivered to the hotel?
There were other travellers from Adelaide on the same flight who had this happen.
Not a great look and start to a long awaited holiday.",0.064,0.909,0.027,-0.6591,0.7143679261207581,0.24974903464317322,0.03588302806019783,2
"We have flown with Singapore airlines many times before and on this trip we found the service especially the meal service to be very average. Cabin was clean, seats were uncomfortable and leg room on new planes appear to have got smaller. Not a good choice of food and quite average when you get it.",0.085,0.869,0.046,-0.3195,0.9245345592498779,0.06786175072193146,0.007603677920997143,3
"My wife and I flew Singapore Airlines Economy, return from Singapore to Perth.  The seats were comfortable albeit a little cramped, as Economy seats tend to be, the food was good although a little difficult to eat in a relatively small space, the in-flight entertainment was good and the staff were personable – so a reasonable flight experience.  I’m 6 feet tall so I could cope with a five-hour flight, but I wouldn’t like to contemplate a long-haul flight in these seats.

One slight annoyance: - when I booked these flights back in December, I had some problems using our Krisflyer points and so contacted Singapore Airlines customer services who completed the booking for me.  Subsequently I was charged 68 SGD – around £41 – which was initially explained as a credit card fee.  Having challenged this, the charge was eventually explained as a service fee applied when using customer services to make a booking.  My complaint – that charges like this need to be explained before the customer commits and not afterwards is still awaiting a formal response from Singapore Airlines some five months later.  Customer service standards with this airline are certainly falling so be aware of this practice before you make a booking through their contact centre.",0.091,0.804,0.105,0.4304,0.5512425303459167,0.33909326791763306,0.10966413468122482,4
"So I thought hey, let's book with a 5 star airline for my honeymoon! Boy was I wrong, they can't even make the booking? Waited for confirmation and received nothing so I call my bank and they confirm money has been sent, call the airline and on multiple occasions, they tell me they have no booking for me and received no money, after abusing my bank refund as Singapore airlines refused any knowing of this booking, finally received some food news that Singapore airline had a glitch and the money would be refunded in 10 business days, never had I gone through so much stress and I asked for compensation and kept getting oh we cannot confirm any compensation as there was never a booking....",0.127,0.873,0.0,-0.9334,0.838836133480072,0.14642652869224548,0.014737413264811039,1
"Flying with Singapore Air from Istanbul to Singapore and then Surabaya and back to Istanbul was fabulous!
Particularly with the professional approach and care of Ms. Zulfiye Keles from Singapore Air-Istanbul , she organized all details for our special son with wheelchair; as get in-out of airplane, seat(cannot sit-posture problems), food(cannot chew/feeding problems), and all for my son’s needs that she took care of our son was wonderful.
We are very thankful to Ms. Keles and all Singapore Air team.

We had great service on airplane for our son’s special needs. All the people from check in to gate people and flight attendants were great and helpful; made us all feel safe and comfortable.

We will fly again with Singapore Air in 6 months everything works out wonderfully.
Happy we chose Singapore Air.
Thank you very much.",0.0,0.704,0.296,0.9941,0.0020066872239112854,0.012786569073796272,0.9852067828178406,5
On such a short flight the service was great. Food was tasty and a glass of wine with it hit the mark. Much better than the previous flight into Singapore.,0.0,0.788,0.212,0.7906,0.0013512203004211187,0.009999831207096577,0.9886489510536194,4
"Boarding was on time and the flight was pretty full. Good movies and seat comfort was okay but the food was terrible, tasteless breakfast with no salt or pepper to season anything. Yuck.",0.169,0.655,0.176,-0.4019,0.713796854019165,0.20792894065380096,0.07827425748109818,3
"Travelled with Singapore airlines for the first time with family. We loved the overall experience. The food was good (took me by surprise as I'm yet to taste good in-flight food) , the seats were as expected in economy with the leg space being really good. The staff were polite and accommodating. Despite their busy schedule, they helped change a couple of food orders for my family.
Highly recommended airline for economy travellers!",0.0,0.792,0.208,0.944,0.00204581581056118,0.012904860079288483,0.985049307346344,5
"We have just returned from Bali. Our return from Singapore with Singapore Airlines was more than disappointing it was unacceptable. We flew Premium Economy, the seats are more comfortable but once the person in front reclines their seat it’s is as bad as economy. You need to book row 31 for window seats or middle 33 .. if not available don’t waste your money. Seats aside what was the deal breaker to travel with Singapore again was the crew. The attitude was terrible. They clearly did not want to be working.. rude, indifferent and clearly irritated by every passenger. Food was dreadful, cold and a lack of drinks being offered. Should have asked but didn’t want to poke the bear… High price tag for low and poor service.",0.244,0.679,0.077,-0.9781,0.9481018781661987,0.04562056437134743,0.006277615204453468,1
"In general aircraft gave the impression of being old and tired, seat was uncomfortable and  soggy, seat recline not working, seat hight not sufficient (I am 6ft 2in)
WI-FI not available to Premium Economy passengers, had travelled with Qantas 3 times in Economy recently WI-FI provided free.
Not the Airline it was",0.095,0.815,0.09,-0.0772,0.8992723226547241,0.09130208939313889,0.009425560012459755,2
"My first trip after the pandemic was a little disappointing.  The aircraft was good (an A350) but the Business seats were poor compared to their competitors.  It is apparently their 'regional seat' for shorter haul journeys. It is too skinny and a tight fit for your feet if sleeping. It is 'second class'.

Food was good but the staff forgot to offer me the Refreshment meal.  I did not complain because the tray table at my seat was not working properly and I did not want to be caught jammed in my seat ( as happened at Lunch).  However, they did not find out until clearing up and while apologetic, it was poor considering the prices demanded for Business these days. It also appears that you have to ask for a second drink as I was never offered one. Tea and coffee are in short supply as well. 
I 'booked the cook' for Lunch and the food was excellent but like 'special meals' it came early before the regular meal service and I had finished eating before any wine or other drinks came around. 
The Cabin Crew are always nice but it appears that organisation is lacking and my flight was disappointing as a result.  Certainly second class for the price.",0.075,0.785,0.14,0.9453,0.6352888941764832,0.28689515590667725,0.07781598716974258,4
"If there was an option for no stars, I would select that.

Singapore Airlines from Bangalore, India to Singapore which was set to depart at 0120 was delayed by ~3 hours. The flight reached Singapore at 1130. Due to this the connecting flight to Perth which was set to depart at 1200 was missed. Due to this I along with my partner had to stay in Singapore city overnight at our own expenses at a hotel.

On arrival in Singapore, I inquired with Singapore Airlines Duty Manager on what our options were as our onward journey had been disrupted due to this delay of almost 3 hours to which I was offered no solution at all. In fact, my request was brushed aside by the duty manager based on the fact that I did not have a connecting flight booked with Singapore Airlines or Scoot and that this situation was ""no longer Singapore Airlines Problem"". I explained to the Duty Manager that a missed connection (either with Singapore Airlines group or any other carrier for that matter) put us in a position where we would incur costs associated with accommodation, meals, transport and loss of pay (in my case) to which the duty manager responded that those would have to be borne at my expense even though the delay was caused by a Singapore Airlines. As mentioned earlier, the general gist of the responses I received from the duty manager was that ""this is not our problem"".

The treatment meted out to me by a duty manager was sub par to say the least and certainly was not expected from an airline which is considered to be among the best in the world. I even worte to them and they have conveniently told me that I need to check with my insurance company and that they aren't liable.",0.07,0.896,0.033,-0.8201,0.5422902703285217,0.4063270092010498,0.05138276144862175,1
"This was a terrible flight.  A tiny business class bed, no sheets/covers, horrible pillow, terrible covers Zthat were crumpled and shabby.  We left at midnight and we’re offered food.  We were woken at about 5.00 and offered food but I couldn’t get a cup of coffee and when I did it was cold…really cold.  Hey friend in coach couldn’t get a bottle of water, food was ok, just… and a sweet white wine…
This plane should have been burned straight after COVID.  The service is NOT what we would expect from Singapore airlines !  Take this tip… avoid SG airlines",0.1,0.772,0.128,0.7177,0.9351615905761719,0.05589912086725235,0.00893919076770544,1
"I understand how an airline can lose a suitcase. What I don’t understand is how an airline does not have a system in place to track a lost bag, communicate with the customer and close out the case in a respectful manner when the bag never shows up.

Let me try and explain. I have been flying SIA back when they were still Malaysia Singapore Airways. I've always been impressed by the quality of the service until my last trip from Cape Town to Bali. In short, one of our bags never made it. I understand this can happen. It is not just the inconvenience of a lost bag it is also mourning the loss of memories for the items that were in the bag. 

Repeated phone calls and visits to the airport never resulted in the case being closed. It has been a year since the bag was lost and intermittent and sparse communication still leaves us wondering about being compensated and being done with this issue. Pretty shocking customer service.",0.097,0.839,0.063,-0.6237,0.8200007081031799,0.15486952662467957,0.02512982115149498,1
"Where can I start now… SQ has just dropped its standards when it comes to meals, drinks and onboard amenity kit. Only one meal on a 7.30 hour flight from SIN to SYD and no amenity kit on an overnight flight.
You get a dinner meal and that’s all you get. No breakfast, NO tea or coffee in the morning. The crew just take trays of water throughout the flight. Also the dinner is only 2 courses meal. Even Emirates is still serving 3 course in economy. Interesting that SYD to SIN sector you get two meals and more. Does SQ discriminate on who is flying onboard ? Qantas is providing 2 meals on SIN to SYD sectors.
It feels like SQ has cut down on many things and charging customer must higher fares for low quality product. 

SQ can't be considered as 5 star airline anymore. You might as well fly on Scoot for lower fare and pay for the meals. 

Crew and the aircraft are good but meal service is failing SQ.

Please restore your services to pre-covid times.",0.122,0.811,0.067,-0.8256,0.536289393901825,0.37988200783729553,0.0838286280632019,3
