Summary,vader_neg,vader_neu,vader_pos,vader_compound,roberta_neg,roberta_neu,roberta_pos,Rate
"Recently used Singapore airlines, unfortunately flight from UK to Singapore was running 45 minutes late, we just made our onward flight from Singapore to Lombok. Service at Singapore was excellent.
Our bags did not make the onward flight.
These things happen, however the service we then had was terrible, the customer service rep at Lombok was useless, we landed , were then informed that our cases were not on the flight, told we would get them three days later, ABI the service rep filled out the paperwork. Turns out he did not fill in the forms correctly, he did not give us a tracking number, he did not make copies, so waste of time as forms that were filled out he gave to us.
We then used Singapore airlines online/live chat to try and find out where our luggage was. They were very unresponsive as they did not have a lost luggage tracking number, I thought they could enter our luggage label number. 
Told me to go back to the airport, since this was nearly a two hour trip I declined.
ABi did not answer my texts to my Satisfaction, when cases did arrive at 1030 he said he had to Finnish his shift at 15.00 before sending them on.
When he did send them on we had to pay for boat to bring cases over to island we were staying on, then pay the local taxi to bring them from the boat to the villa.
This could have been way more professional.
Filing in form correctly so we had a valid code we could chase up.
Singapore airlines being more helpful 
I don’t think we should have to pay to get our luggage delivered 
And just any type of communication with the airline/airport service rep, instead of ignoring the vast majority of my texts, NEVER answered the phone.
Can’t wait to discuss this in person on my way back through Singapore ",0.056,0.897,0.047,-0.5042,0.7523873448371887,0.20768190920352936,0.03993077948689461,1
"The 2 worst flights of my life , always late for the 2 flights ,mismanagement.So I do not recommend this company.

thank you for doing nothing good.",0.286,0.631,0.083,-0.7283,0.9686360359191895,0.02679683268070221,0.0045670983381569386,1
"I specifically chose to fly with Singapore Airlines due to my positive experiences in their Economy Class from years ago. Having explored premium Economy options with various airlines since then, I was eager to give Singapore Airlines another try, considering their esteemed reputation and my previous impressions.

Regrettably, the experience fell short of my expectations. Both legs of the journey, from Zürich to Singapore and back, featured uncomfortably cold cabin conditions. While the staff were friendly and hospitable, I didn't sense the distinctive Singapore Airlines ambiance I remembered.

What disappointed me even more was the absence of an amenity kit. Additionally, having to share toilets with Economy passengers was less than ideal, resulting in lengthy queues reminiscent of standard Economy travel. The meal service was identical to what one would receive in Economy. While the privilege of checking in and boarding ahead of Economy passengers is granted in Premium Economy, I questioned whether it justified the higher price point. Personally, I found that the added value, aside from extra legroom, didn't justify the cost.

I must admit that Lufthansa and ANA offer significantly superior Premium Economy services. They provide access to lounges and offer amenity kits (in the case of ANA). Even LOT surpasses Singapore Airlines in terms of attentive staff.

Cathay Pacific also outshines Singapore Airlines in their Premium Economy offering, excelling in terms of food quality, attentive service, and the provision of a modest amenity kit.",0.039,0.815,0.145,0.9767,0.5504211187362671,0.33832240104675293,0.11125655472278595,2
"Bought Economy  Lite fare for 2 persons.
Was given separate  seats on the flt.
Customer  service informed that these fare ticket only entired you to a seat and does not guarantee seating together.
Need to buy seat selection and if not 48 hours before flight complementary selection is available. 
Well the airline should at least put us any Economy seats together.",0.029,0.937,0.035,0.0926,0.4721834361553192,0.46752864122390747,0.06028788536787033,1
"After flying four times with them recently, I have come to the conclusion that Singapore Airlines is the best in the world. Their service is beyond comparison.
Keep it up...",0.0,0.87,0.13,0.6369,0.0021781884133815765,0.016329646110534668,0.9814921021461487,5
My husband and I found travelling to Sydney a very good and comfortable experience. The air stewards were very helpful and polite. The food was good and plenty of drinks provided throughout the journey.,0.0,0.682,0.318,0.9192,0.0013079489581286907,0.00861128605902195,0.9900807738304138,5
"According to Singapore Airlines My Plane Was A A350-900 (A359), Lots Of Inflight Entertainment and Lots of Movies To Watch, It Doesn’t stop There, Although My Flight was 2hrs It’s has been a good time with Singapore Airlines, Hope To Fly With Them Again",0.045,0.779,0.176,0.7506,0.0016263965517282486,0.027705522254109383,0.9706681370735168,5
"On my flight I got sick with severe chills headache and fever , I asked cabin crew for some medication and they stalled and didn’t give me any . I was so sick and die to Covid I kept very quiet as I didn’t want to cause chaos amongst other passengers - the first thing the cabin crew did was put in their masks and stayed away from me .. I asked the crew over and over again for medication and they DIDNT give me any - the flight was full and I suffered 17 hours with no help . Then I asked for a hot pack and they brought me a wet towel heated in the microwave which made it worse As the water started dripping all over me :( and then to make it worse they have my special
Ordered meal to another passenger . And the Ignorant flight attendant brings me a pasta meal with shrimp . I tell her I am allergic to shrimp - she says remove the shrimp and eat the pasta only — it was a nightmare as 
 I was shaking and so upset but had to keep quiet as I knew there would be chaos if I told everyone I was sick - when I sent in a complain to Singapore air - they basically told me I was lying - as the cabin crew gave me medication and they never offered me a shrimp meal - it’s sad that they didn’t at least apologize but swept my complain under the carpet ! This is so wrong :( and I wanted at least an apology .. this is the airline that calls then self the best ! They are not they are liars … and didn’t care that I suffered on the 17 hour flight -",0.211,0.722,0.067,-0.9918,0.9489399194717407,0.04642238840460777,0.004637737758457661,1
First time flown with singapore airlines  to Australia  can honesty say I will definitely use them again staff very helpful and just lovely on all flights singapore airport was thr best airport ever stepped in the whole experience was great ,0.0,0.61,0.39,0.9686,0.002015866572037339,0.010664253495633602,0.987319827079773,5
"We had to shorten our trip to Vietnam due to the rainy weather and it was impossible to contact ANY phone numbers listed for Singapore Airline (we even had family back home try to contact those numbers for us to no avail...we ended up using a third party to book new flights. I really thought the self described ""best Airline in the world "" would have a better customer service than that. 
Their ridiculous limits on carry-on luggage is really frustrating too.i will avoid them in the future. 
That said the quality of on board service was good.",0.104,0.779,0.116,0.5118,0.6515967845916748,0.26237165927886963,0.08603159338235855,2
"Subject to a 5-hour delay which then caused us to miss the connecting flight and extend the delay to 30+ hours. We were placed in a hotel by SQ adjacent to the airport for a sudden 24hour plus layover near midnight with a ""food coupon"" that we had to fight for as we were starving due to the long delay and no food service on the plane. After arriving at the hotel we found out that those food vouchers were not even valid according to the hotel, Capri by Fraser, and no food service was available. Capri by Fraser's on duty manager in Singapore apparently said they don't take ""food coupons"" from Singapore Airlines for emergency layover guests and that this was a miscommunication with SQ. At near midnight where nearly all restaurants were closed and Capri is far from the city center, how were we expected to get a meal after being misled by Singapore Airline staff at the airport about the availability of food and their miscommunication? What if we were first time guests in Singapore with no knowledge of the local language and not able to navigate the situation? This is a complete failure from a management perspective as delayed passengers who miss connecting flights after a certain time at night should at least be informed properly if not put in a hotel with 24 room service/dining options in or nearby and given the courtesy of not having to worry about starving on top of rearranging travel plans etc. For an airline with a world class reputation where one pays a premium for the service this just is not acceptable.

I submitted a complaint to Singapore Airlines but their complains team threw a response back at me: “as much as we acknowledge the inconvenience you went through as a result of the delay, as an industry practice, and in line with our Conditions of Contract and Carriage, we would like to share that airlines generally do not compensate for consequential losses or inconvenience arising from flight delays.” However, I know international passenger rights stemming from Article 19 of the Montreal Convention which covers delays due to fault of the airline. SQ senior customer service staff repeatedly mislead and misrepresent int'l passenger rights trying to essentially brush me off.

There is a lot more to this story but currently they have ceased responding to my emails and appears to think that ignoring the issue will fix it. I don't know what more I can do at this point but I hope this review will serve to shed light on the holes in SQ's 5 star service and ""World's Best Airline"" reputation. I hope no one has to experience what we experienced during that disastrous layover in Singapore.",0.117,0.824,0.059,-0.9686,0.8372896313667297,0.14999178051948547,0.012718645855784416,1
"My partner and i decided to travel to Australia on Singapore airlines,the checking in at London Heathrow was very easy,the plane was quite comfortable considering a 22 hour trip,the cabin crew were very friendly and acomadating,drinks when you wanted it and two meals to Singapore and plenty of films,tv programmes and music on our individual screens, we had a night in a Singapore airport before continuing our journey to Sydney ,our return journey eighteen days later was good but with only two hours stop in Singapore airport before returning to London ,with the same quality service from Singapore airlines",0.028,0.907,0.065,0.4005,0.002309852046892047,0.03945353627204895,0.958236575126648,4
"Our flight with Singapore Airlines departed on time, arrived on time into Singapore with a 50 min transit, to change to flight SQ 306, to continue through to London. Every facet of our travel (check-in confirmation, baggage check-in, travel, all meals, flight x2, to picking up our 4 suitcases was without any issues arising) with the airline was smooth without any issues. All staff were excellent and dealt with full flights with the 1st flight on an Airbus A350, with the 2nd flight on a Boeing 777-300, that arrived about 30 min's early into Heathrow. Would we ever travel with another airline our of Australia. the easy answer is, 'NO'.",0.0,0.941,0.059,0.765,0.0170773733407259,0.15808558464050293,0.8248370885848999,5
"Flew on 21st Oct 23, flight seems almost full.
Last Flew on SQ was almost 10yrs ago, which I remembered the flight was cold and cozy.
But this flight has been a very terrible experience,  seat was not comfortable,  front seats is too closed , very difficult to view the screen on the seat in front of u.

Worst part is the air control,  its not cold but very warm and stuffy!  There wasn't any air vent hole for u to control the cold air blowing at you. But seems to come from the top. It's more like a dehumidifier setting rather than aircon . I saw ppl around me all fanning themselves! 

Yes ppl have to fan themselves like in the 80s where buses have no aircon , hot stuffy and soaking with perspiration atvthe end of the 5-6hr flight!!!

Will not take this flight ever again , horrible experience!",0.15,0.743,0.108,-0.8842,0.9034404158592224,0.08240474760532379,0.014154826290905476,2
"Come on ! Singapore Airlines the Buisiness lounge is total joke ! M
If this is 1st impression you offer of your Buisiness class then it’s sad sad 😢 

Really guys give us a lounge in keeping with the rest of your services ",0.151,0.758,0.091,-0.5696,0.9242728352546692,0.06627878546714783,0.009448297321796417,1
They don’t let you add your frequent flyer number for a partner airline unless you do it at the check in counter. They only let you add their own FF number. Really poor experience and really dumb policy.,0.155,0.709,0.136,-0.4316,0.9117515087127686,0.07975047826766968,0.008497979491949081,1
"Recently had three flights with Singapore Air during a recent trip to Europe from Australia.  I found the check in service quick and efficient, staff were really nice & everything was on time. I found the economy seating to be more roomie than a few other airlines that I've travelled with and the Staff were very accommodating.  Would highly recommend travelling with them.   ",0.0,0.864,0.136,0.8265,0.0016641713446006179,0.01882489211857319,0.9795109033584595,4
A great experience once again with Singapore Airline. We were in transit. The boarding was very orderly. On board service was excellent. The crew was very helpful and polite. The only slight problem was the food  tray table. It was too small to keep food tray on it and eat comfortably.,0.044,0.733,0.223,0.8999,0.00660927128046751,0.027989158406853676,0.9654015898704529,5
"We were offered the choice of carriers from England to Vietnam and chose this airline on the basis of a friend's recommendation and that he had been impressed when he had last used them. Priority check-in went smoothly, however the friendliness of the staff left a lot to be desired. The lounge was clean, tidy and a full selection of hot and cold meals and liquid refreshments provided.
The flight to Singapore was very comfortable with a large seating area where you could fully stretch out, however some of the cabin crew gave the impression that explaining the various controls and screen changes was beneath them. The menu was good  and the meals were tasty. The lounge again was average, however noise and distractions from other traveller's spoilt the ambience.
From Singapore to Vietnam the cabin crew were attentive and extremely responsive. This was a slightly smaller airliner, however the seating arrangements were adequate.
The return trip was basically similar to the inward journey, but the cabin staff were perhaps more attentive due to it being mainly a night flight and they had more time to devote to each passenger.
The central seating means that it is almost impossible to have a conversation with your ""flying"" partner due to the distance between parties. Each passenger is provided with headphones, blanket, cushion, socks and footwear, however the entertainment choice is severely limited.
i was led to believe that the trip would be memorable, but the hype did not match the reality.",0.03,0.866,0.104,0.937,0.07341030240058899,0.3321459889411926,0.5944437384605408,3
"I flew in the rear of the plane this trip, very unuasual for me at my vintage. And I was delighted to see the attention to detail offered by the staff in every section of the plane. Even pre~boarding &  the check~in staff took the time, smiled and treated me a pleasing bag~tagging. ""Markia' & 'Zane' earned high marks from this Mark!  I asked to board early at the gate: I wanted to note the ebb & flow of boarding an airplane for an on~time departure... There were subtle, yet wonderful difference in helping customers. Crew helped shuffle overhead bins as needed...Other airline staff stand~off and leave it to the pax to sort... Observant SQ team members worked smoothly to re~unite families with small children, helped with the need for another pillow or blanket,and thrughout the flight, seemed to pay special attention to their customers... A special shout~out to 'David"" and his peers at the back of the plane! Good service starts at the top...so we need to say thanks to the burser on~board,'James' who clearly led by example... For this entire team, they appeared to be honoured to be flying...other carriers seem to have staff that see this line of WORK as a real 'chore'... At This airline, it appears to be more of an honoured VOCATION to serve...Keep it Up Singapore! ",0.011,0.833,0.156,0.9879,0.0042671081610023975,0.0532781183719635,0.9424547553062439,5
"Food is always delayed. Breakfast will be served as brunch, and dinner will be served in early morning. Not a good experience for Senior citizens and children",0.152,0.848,0.0,-0.5116,0.9287534356117249,0.06501400470733643,0.006232528015971184,1
"Singapore Air was good years ago, not anymore. We bought tickets with prepaid seats. A month before flying Singapore Air changed our seats without paying a refund. It is unclear what we paid for if seats can be changed by Singapore Air without giving our money back. 
Service was very average.
We will avoid flying with Singapore Air in future. ",0.099,0.855,0.046,-0.3261,0.583444356918335,0.3251936733722687,0.09136196970939636,1
"Had a great experience flying with singapore airlines but only to arrive in Sydney with my luggage missing, I am staying in Sydney for 6 months so brought my whole wardrobe and lots of valuables, It’s put a dampen on my trip and it feels like they aren’t prioritising finding it. ",0.05,0.771,0.178,0.7992,0.27459612488746643,0.36304789781570435,0.36235594749450684,1
"The service was poor, the food not edible,   I like a beer on a flight, first time I’ve ever been given a ⅓ can of warm beer in a plastic cup, yum.

This is a budget flight at regular prices.

Flown Singapore Airline several times but I cannot explain the drop in quality on this and the return flight.

Cairns people your getting ripped off.",0.06,0.879,0.061,0.017,0.8583407402038574,0.11746396124362946,0.024195317178964615,2
This was a great flight the service was perfect the food was good and plentiful the seats were good with plenty of room even in economy we landed on time didn't take to long to de plane ,0.0,0.702,0.298,0.9274,0.0025398069992661476,0.013257765211164951,0.9842023849487305,5
"Had to fly SIN HAN and had several choices for carriers. Heard all the hype about flying Singapore Airlines, how it supposed to be great, etc. I think the hype is gone. Don't get me wrong, it got me from SIN to HAN ok but it was a little 737 max for an international flight, was served a bento box for a meal, and to be honest I was really hoping for more. The ticket was more than say on Vietnam Air or Air Asia so I thought you really got more bells and whistles but it was just a regular flight with almost no frills. Even the excess baggage fee was quite high, you would think after paying for such a high ticket they would cut you some slack on the fees. In flight service was fine but I thought they would come around more than just giving you your ""take-away"" box. I guess all the hype that Singapore Airlines has the best service is no longer. At least I left out of T2 (versus 4) from Changi but I'll be flying someone else on those routes next time. ",0.062,0.811,0.127,0.9361,0.2042289674282074,0.49097010493278503,0.30480095744132996,3
"Received a bottle of water at the start of the 16hr flight, and finally had to walk to the back of the plane to ask for another bottle of water, this after about 7 hrs. Food? One meal at the start of the flight, and as i sit here writing this 11 hrs into the flight, no more food, i.e. meals or snacks. Oh, no stewardesses either. I get better service on a 1 hr flight on southwest!",0.061,0.901,0.038,-0.2003,0.18990860879421234,0.38261866569519043,0.4274728000164032,1
First time flying with Singapore Airlines the flight out in economy was very good with nice service food and good setback entertainment however we were disappointed on the return flight after paying for premium economy the food was poor as was the seatbelt padding was awful and the service was below average I know it was a night flight however I was parched on landing we may use the same flight next year but would only do economy ,0.074,0.827,0.099,0.2558,0.6452791094779968,0.2561487555503845,0.09857212007045746,3
"Comfortable seats, great service, good food, good entertainment system. One of the best international airlines. ",0.0,0.308,0.692,0.9648,0.0013702241703867912,0.012882144190371037,0.9857476353645325,5
"Check-in staff did not know rules for carry-on liquids. She insisted we could only carry on a total of 100ml when the Singapore Airlines website clearly states 100ml maximum PER CONTAINER, with a total maximum of ONE LITRE. It wasn't a big deal - we just checked the bag in - but I find it concerning that  Singapore Airlines staff don't know their own rules and refuse to seek clarification when you question them. Maybe this is just the way of the world now. Maybe I'm just old.",0.033,0.945,0.022,-0.2382,0.7633063197135925,0.21640999615192413,0.020283615216612816,1
"The last time I flew with Singapore Airlines (economy) was pre covid in March 2020.  The service has changed quite a bit since the last time I flew with Singapore.  No amenity pack on your chair with your pillow and blanket, no printed menu, no snacks throughout the flight, limited water, is a shame as it is the little touches that give an airline the edge over others.  That said Singapore is still the best value for the route I was taking.  As we all know flying economy is not the most comfortable but the seats on the plane were pretty comfy and have a good incline when sleeping. I bought a foot hammock for the flight to Singapore and I have to say an absolute game changer, well worth taking next time you do long haul. The staff on the plane where friendly and helpful on all four of my flights and the food that I did have was good.  I had a 50 minute turn around in Singapore to and from Bali and whilst that does not sound a lot it is plenty of time. I booked forward seats for my turnaround flights to ensure I got off the plane quickly.   All in all a different experience from last time but still good.",0.045,0.795,0.16,0.9839,0.014247947372496128,0.08913032710552216,0.8966217041015625,4
"We travelled after a long time with Singapore Airlines. We had great experience flying with them. The check-in was very smooth. The boarding was very orderly in spite of A380 aircraft. The seats were very comfortable. On board service was excellent. The staff was very courteous. I could not try any drinks or food as it was a mid night flight and I had already finished my dinner at airport.
Worth flying. ",0.044,0.751,0.205,0.922,0.003088517114520073,0.02474243938922882,0.9721691012382507,5
"A decent airline with some room for improvement. I've had the opportunity to fly with Singapore Airlines a few times this year and each time I come away with different feelings. The consistency in service that you find on other airlines doesn't seem to exist with Singapore Airlines. Sometimes it's great, sometimes not so much. On this particular flight from Singapore to Dubai, boarding was late by about 40 minutes - not a huge deal but the lack of communication was frustrating. Boarding was relatively quick and the Airbus A350-900 is a fantastic aircraft to fly on. The seat was comfortable (economy) and there were nice amenities for use during the flight, such as a pillow, blanket and headphones. I opted to use my own noise cancelling head-phones connected to the In-Flight entertainment via a cable. As the aircraft pushed back, a flight attendant quite rudely told me ""noise cancelling headphones aren't allowed!"" Before I had the chance to ask why, she had already disappeared. When she passed again, I asked her about her prior instruction and she told me that I could not wear them during the safety video. At this time she realized that they were in-fact connected to the IFE and said that I could keep them on. 

The first meal-service didn't start until almost 3 hours into the flight! For those, like myself, who had connected through Singapore from a previous long-haul flight, it was frustrating having to wait this long as I wanted to maximize rest for the arrival into Dubai. The second meal-service was a slice of over-cooked pizza in a soggy cardboard box. Disappointing to say the least. 

All-in-all, Singapore is generally a reliable carrier with modern aircraft and nice cabins. Perhaps with some work on consistency would go along way. I'm booked to fly with them again in 2024 so it'll be interesting to see if there is some improvement here.",0.08,0.792,0.128,0.9581,0.2848888337612152,0.3811996579170227,0.33391156792640686,4
"As usual, SQ service was excellent.  Crew were super friendly and super efficient.  The food was very good. Great entertainment options.  Nice complimentary wi-fi!",0.0,0.291,0.709,0.9874,0.0016954491147771478,0.009106339886784554,0.9891982674598694,5
