Summary,vader_neg,vader_neu,vader_pos,vader_compound,roberta_neg,roberta_neu,roberta_pos,Rate
"We used this airline to go from Singapore to London Heathrow. We had issues with tickets as they cancelled one of the tickets and trying to get it sorted cost a lot of money due to roaming charges for the lengthy phone calls which were needed to get the ticket reinstated and them trying to charge varying amounts to resolve it. This was a very poor service. 

We got to the airport and had to check in at the desk due to this issue which meant online check in couldn't be done. We were in premium economy which was spacious, two seats on either side of the plane and 3 seats in the middle. The plane seemed relatively new but not brand new. Legroom was good, seats were wider and had bigger arm rest in between the two seats which had the fold away tray tables in. There was a good choice of movies and other things such as TV shows, games etc. The food was ok, didn't seem to be much different from economy standard. The flight crew seemed friendly enough. They didn't really go up and down the isles with drinks only maybe twice for the whole 13-14 hour flight, which on other airlines they would have done it quite often.

Overall the flight was ok, seats were comfy, legroom good. Food was ok. The flight crew could have been more attentive especially with it being premium economy, you would expect the service to be slightly better than economy.",0.019,0.871,0.109,0.9781,0.1950875073671341,0.41383007168769836,0.39108240604400635,3
"The service on Singapore Airlines Suites Class was nothing but excellent. The cabin crew was warm and friendly and, most importantly, came across as sincere and genuine. Throughout the flight, I interacted with Leading Stewardess Sharifah the most, who went all the way out to ensure we were comfortable and well taken care of. I saw her patrolling the cabin consistently to check if we needed anything(I could see her looking into the Suite), and she was always read y to assist us. She even offered to make up our bed after the breakfast run so that we could rest. When I asked if I could walk around both decks of the aircraft, Sharifah volunteered to show me around. She was very knowledgeable about the configurations in the A380 aircraft and even pointed to the best seats in each cabin class as we walked through. 

The Suites Class cabin resembles the private cabins onboard sleeper trains, which gives Suites Class passengers some form of privacy. The cut holes on the cabin doors, in the shape of a flower design, somewhat reduce the privacy we got in the Suites Class cabins. There are two lavatories at the front of the aircraft catering to the six Suites Class passengers. The lavatory on the right is the bigger of the two, featuring a vanity table between the toilet and the sink.  There is plenty of space in this lavatory for passengers to change into the Lalique pyjamas provided to Suites Class passengers. The lavatory on the left was smaller but no less luxurious. Passengers using this lavatory can still find it spacious to change in and out of their pyjamas. This lavatory still provides the same amenities as the larger lavatory. 

Not all suites have the same size. The biggest are the foremost Suites (1A and 1F), about 5m2; the smallest (3A and 3F) are the aftmost Suites measuring 3.3m2. I occupy the middle Suite (2A) with 4m2 of real estate. Each Suite is fitted with both a chair and a bed.  The walls of the Suite were printed with floral designs that enhanced the luxurious vibe and did not come across as being too loud or over the top, consistent with the design language of the cabin. A side table sits by the entrance of the Suite. The flight attendants use this side table to place our drinks or snacks without needing to deploy the table.  The table is solid and huge, providing tons of space for Suites Class passengers.  The table can be swivelled for passengers to get in and out of the seat without stowing it away. 

The seat was the first thing that caught my eye when I entered my Suite and is very comfortable. An oversized pillow is placed onto the seat to provide passengers with greater comfort, especially in reclined mode. The seat measures 35"" wide and can recline up to 45°. The calf rest of the seat can only be deployed when the seat is swivelled to face the TV or the front of the aircraft (the green light on the control panel would light up to indicate calf rests can be deployed). Swivelling of the seat is controlled electronically via the control panel built into the left side of its armrest or the tablet provided in the Suite. There are two power sockets that came fitted with USB-A charging outlets in the Suite, one at the side of the side table at the entrance of the Suite and another on the storage cubby by the window. Singapore Airlines Suites Class features a bed in the Suite on top of the comfortable seat. Singapore Airlines uses Lalique bedding for the bed. I found the bed was very sturdy, lacking in terms of comfort. The mattress padding was a tad thin and lacked cushioning. The two pillows that came with the bed were too soft for my liking. 

There is no lack of storage space in the Suites Class onboard Singapore Airlines. Besides the pockets and shelving on the bulkheads and the seat, there is a small wardrobe by the door. Due to the slim design of the wardrobe, a limited amount of things can be stowed here. There is space in the wardrobe for passengers to hang their jackets. The bottom part of the wardrobe allowed me to stow away my backpack. More storage is fitted into the bulkhead of the Suite. Due to the shallow design of these cubbies, I could only use them to store smaller items. Singapore Airlines designed an open shelving space with a single leather strap beneath the cubby holes. Singapore Airlines fitted a 32"" HD touchscreen TV in the Suite. The TV can be swivelled with a touch of a button either on the seat or from the tablet to face the passengers when sitting on the seat. There are two IFE controllers in the Suite; a smaller one is stowed in the seat's armrest, which I found very intuitive to use. The other IFE controller is via tablet in the Suite.",0.023,0.903,0.075,0.9935,0.01197671890258789,0.27613702416419983,0.7118862271308899,5
"Booked, paid and received email confirmation for extra legroom seats 10 Dec. 4 Feb checked and seas were gone. They resold our paid for seats and put us in standard seats. I have a spine support device that means I require the extra space. Couldn’t use it and had a 13 1/2 hour flight. I exited in a wheelchair unable to walk for my three week holiday. Tried 37 times to reach them, Philippines call centre is appalling.",0.033,0.882,0.086,0.4588,0.9045141339302063,0.0855548158288002,0.009931031614542007,1
"Best airline in the world, seats, food, service are all brilliant.  The crew are friendly and welcoming.  We love flying with Singapore Airlines",0.0,0.496,0.504,0.9601,0.0017520289402455091,0.006744368001818657,0.9915035963058472,5
"Premium Economy Seating on Singapore Airlines has narrow seats and poor leg room compared to Air NZ or Virgin.  Drinks served in plastic beakers, roast chicken tough as was the meat in the noodle dinner.  Orange juice concoction was not a premium offering.  Toilets - we had to walk half way back down the Economy cabin to queue for the toilet.  One toilet on the plane was not working. Having flown with Air NZ the day before the difference in amenities and poor value for money was apparent with Singapore Airlines.  Poor Kris Flyer website if you wish to upgrade it doesn't work!",0.1,0.854,0.046,-0.7177,0.8728033304214478,0.11254264414310455,0.014653957448899746,2
"We booked our flights a full 9 months in advance and paid well over $11,000 for a trip in 2 weeks time. we then booked our trip around the flights. Over the past 2 months they changed our flights over 6 times resulting in over 15 hours of stop overs and delays, making the trip almost 32 hours long.
We booked through flight centre and paid the extra to be able to cancel the flights.
Now we're having to fight tooth and nail just  to get a response let alone our money back. 
We're now at the unenvious point of paying for litigation to reclaim our funds that they have had for 9 months to use as they wish.
I have flown well over 30 times with this airline and our business and family hundreds of times but this is the end of our relationship and we will never fly or recommend them again.
Such poor integrity.",0.091,0.856,0.052,-0.6445,0.8185054063796997,0.15980099141597748,0.021693585440516472,1
"This was a fascinating experience. As I sat into my seat, the stewardess offered me a warm towel and I felt very very welcomed. They treat you too well haha. The seats were comfortable. They even gave me a teddy bear haha idk why.",0.026,0.554,0.42,0.9654,0.0017359317280352116,0.006656582001596689,0.9916075468063354,5
"Very bad expeirence for flight check in at baiyun airport! It took one hour plus to Q. Only 5 counters for economy class and 2 for business class. Lousy, no more SQ in my life!",0.251,0.749,0.0,-0.8772,0.955490231513977,0.039499588310718536,0.005010123830288649,1
"Respected Faculty, I am Bincy, writing this  to file a complaint regarding a cancellation of the connection flight of Singapore airlines and the irresponsible service from Singapore airlines airport staff members at Singapore .My parents 67 yr old Dad as 63 yr old Mom travelled from Brisbane airport in Singapore airlines  SQ236 yesterday at 14.45 hrs and arrived at Singapore airport at 20.25hrs yesterday late evening. Then only they were informed that the connection flight SQ 536 which was booked and  confirmed, has got cancelled and they have to wait until next day night. This was not informed to us in any form of communication. 
And secondly, though my parents are very older with so many health issues, (my parents are Diabetic also, taking insulin and my parents have high blood pressure, taking medications)but they had to wait in airport in a chair without any support for 24 hours without any food especially when they are from a non English speaking background. The mental stress and physical discomforts for 24 hours they were gone through are unimaginable and we cannot express it to the full extent. They didn't get any emotional or physical support from staffs at Singapore airport.They didn't arrange any room to rest or any proper lounge and not even any food for 24 hours (my parents were not prepared to stay at airport for more than 4 hours as  we booked the tickets with least transit time at Singapore airport)
We had a trust in the services of Singapore airlines, and so we booked the flight for our parents with much confidence. 
We booked the tickets through an agency Sanjo travels in India but we got the confirmation that Singapore airlines didn't inform the agency as well. So it's completely the mistake from Singapore Airlines.",0.064,0.906,0.03,-0.6737,0.7866054773330688,0.19476546347141266,0.01862906850874424,1
"I would rate Singapore airlines the worse I have ever travelled with.
The only plus was we left on time & arrived on time.
Firstly no one  brought headsets had to ask for one.
The bfst omelette was awful part yellow part brown, the rest inedible. 
The milk & butter if you get any! Now comes in liquid form squeeze tubes.
No decaffeinated coffee no hot chocolate.
We then had a wait of nearly 11 hrs without food, I went to the galley hoping to get a sandwich but all that was available was banana or kitkat!!!
Other than trays water nothing was brought around in the 11 hrs!! No choice of juice.
The films available where limited & not up to date.
Dinner eventually arrived again inedible no before dinner drinks , the trolley had a choice red wine or white wine ( Chardonnay) but you only got half a plastic cup of wine no repeats!!
I believe this cost cutting is to their detriment. Out of choice would never travel with them again.",0.128,0.861,0.011,-0.9487,0.8489261865615845,0.12844404578208923,0.022629836574196815,1
"Singapore Airlines (SQ), may be one of the largest airlines in the world but its customer service is appaling. Our flight was canceled and instead of 4 hours of stopover in Singapore, we now have 16 hours to wait! And nothing ! No excuse, no compensation! What company treats its customers like this ? I called customer service several times and the third time I found a person who was very rude, like ""4 p.m., you have time to visit the city, what are you complaining about?"" . We will arrive before midnight, we leave after 3 p.m. We will have to take a hotel and the company won't even compensate us. one of the best airlines in the world? Really ?",0.071,0.786,0.143,0.9105,0.9078146815299988,0.07951366901397705,0.012671721167862415,1
"Yesterday ( 6 March ) my flight was canceled by the Singapore airlines . After many calls they said that you bought the ticket through booking.com and call them and they should resolve this issue. and singapore airlines didn't want to talk to me anymore. 
I called booking.com and they tell me to call to Singapore airlines.I explain to them that Singapore airlines does not want to help me because I took the tickets through you. 
This went on for several hours. a few hours later Singapore airlines gave me another flight in another state( I bought ticket from JFK NY State , they give EWR NJ ; ) it will cost by taxi around 300$ from NY to Newark 
no matter how bad it was, I agreed and thought that I would fly the next day. but... when I started registering I noticed a mistake they made. 
They gave me a two flights : 
first from EWR - SQ 21	•	7 March 9:35 AM- 8 MARCH 5:25 PM Singapore airport .
 But my second flight was SQ 728  8 MARCH 
 9:50 AM from Singapore .
 How it is possible ? if the plane arrives in Singapore on March 8 IN THE EVENING 5:25 pm and second flight has departure is IN THE MORNING on that day?!!!!
 I called again to booking .com they send me again to Singapore airlines , Singapore airlines send me again to booking ( Singapore airlines did not want to do anything for me. 
if they wanted they would solve this problem!!!!
 I had a similar situation with Emirates airlines , my ticket also was booked from booking .com . 
Emirates  resolved same problem  quickly without any difficulties and with many apologies. 
But  Singapore airlines didn’t even apologize and most importantly, it didn’t want to help solve the problem that iT SELF CREATED .  
After many calls to booking.com representative told: WE DO NOT have any flight for your second connection. When I asked : What I need to do , I need to fly , I bought ticket . He said me ….. call to Singapore airlines . 
I explained again and again Singapore airlines send me to your company.
But representative said me : we can not do you second flight. Call to Singapore airlines. My vacation was ruined and I was very upset . I will never buy tickets through Booking.com again and never through Singapore airlines also. 
Inhumane people work here who do not want to solve the problem that they themselves created.
 This is a real mockery of a person . A SHAME!!! . I will write everywhere and tell everyone about such unfair treatment of people. I buy another ticket from another company , I spend my nervous, money , my time !!! 
A SHAME!!!
Never again with booking.com and Singapore airlines . NEVER",0.122,0.822,0.057,-0.9852,0.753402590751648,0.21927188336849213,0.02732555754482746,1
"What has happened to Singapore Airlines? I used to enjoy flying with this airline. My last flight was abominable. Flights were delayed. The food was terrible, just a doughy bit of pizza for dinner. The staff stressed. The seats on the plane were very cramped and im not even a large build person. Not the quality we used to expect from this airline.",0.111,0.841,0.048,-0.4939,0.9533557891845703,0.040066543966531754,0.006577658466994762,2
"I am disabled and had a VERY BAD experience with Sydney Disability services so at check in desk lady offered me to upgrade from economy to premium for $380 - she said they had lots of seats and she checked on the phone with the relevant department. She took my money on debit card and issued me a new boarding pass. On the way to the aircraft I was called back and told that the fare I originally paid did not allow for upgrade. I paid the fee offered by Singapore Airline internet - it did not say 'if you order through us we will block any upgrades' or 'if you want to upgrade please pay us more money rather than the quoted price'.
This was bizarre and now they tell me they will send my money back within 10 working days - so basically they 'stole' $380 from me for 10 days. I am a regular flyer with them and, sadly, have 3 more flights already booked between now and June - but they will be the LAST!!!
And guess what customer services don't give a dam!!!",0.068,0.916,0.015,-0.8191,0.861841082572937,0.12330596894025803,0.014852904714643955,1
"Well I have flown to Australia quite a few times with other airlines. Also flown many counties around the world. But I have a fear of heights and flying. I just try and keep my mind off that I'm in the air. Most flight will get a bit of turbulence now and then. It can't be helped, but both the 13hr flight from Heathrow to Singapore. Then the connecting flight from Singapore to Sidney had severe turbulence for 90% of each flight. It was literally like travelling down a bumpy road for the whole journey on both flights with the patches of extra bad turbulence. I spent the whole 2 flights terrified and shaking. Not what you want when flying for 20hrs with a fear of flying. I mean I know turbulence can't be helped, but how could I possible have consistent permanent turbulence for basically the entirety of 2 flight from one side of the world to the other. I don't know if you teach your pilots to fly a certain way, or maybe take short cuts somehow. But it was one of the most terrifying couple of days in my life. And the worst thing about it is I have to fly back with them in 2 weeks",0.175,0.792,0.033,-0.9883,0.9129027724266052,0.07792782038450241,0.009169443510472775,1
"Their Premium Economy cabin is a RIP-OFF. We always fly Premium Economy class when traveling international due to the distance. Very sad to report that we were very disappointed with the dimension of the seat. Due to the poor design where the tray is integrated into the arm rest, so the dimension they show on their site is BOGUS. The arm rest takes up at least 2 inches of the seat leaving you with  the actual seat size that is no larger than their economy class seat. DO NOT PAY the extra $800-$1000 extra for SIA PE Cabin. The footrest does not extend properly, and the seat DOES NOT recline like premium economy in other airlines. The service on the slight from SFO-SIN was great (good attentive stewardess due to higher ratio of staff to passengers, the bathroom was clean and they were generous with their food and beverage/snack services) but on the return flight it was truly a plain old economy class service. In addition to that, they were long delays while we were in transit which resulted in my missing my reunion luncheon with classmates whom I have not seen in over 40 years. The customer service of ground crew is not up the the SIA golden class services they promote. During the over 2-3 hour delay, we were in the waiting area which has no water or bathroom facilities. When I asked the crew how long the delay would be (we arrived early at 0730 for our 1100 flight, missing breakfast etc. ) I was told she has no information to share. Asked if there is sufficient time to leave the area to grab food and do a bathroom break (this was at 1230), was told she has no idea... 
All in all not worth the extra $$$$ and given the mediocre ground service, and the delays etc. I would not use them again, when there are so many other great options out there for premium economy cabins with other airlines. Cathay Pacific is top of our list for Asian travel, Lufthansa, Air France, United and definitely Virgin Air. We heard so much about SIA and decided to pay the HUGE difference in cost this time around. NEVER AGAIN.",0.087,0.821,0.091,0.8182,0.7812216877937317,0.18101990222930908,0.037758342921733856,1
"SQ did lose both of our luggages and they only found 1 out of 2. They were provided with all information like  luggage picture, flight number, Baggage Claim, AirTag information (showing clearly the Location in Terminal 2 at Singapore Airport. Service is very poorly/not existant. No updates besides automated mails stating they are „trying“ to find the luggage. Internal communication only via mail - therefore very slow. No service orientation. SQ may be a good carrier if everything works out well, but they have no customer service if help is needed. They are requiring me to spend time on my phone in my holidays and are not doing their job by finding the missing luggage. I hope some people are re-considering their choice of airline carrier in the future towards a more customer-centric airline carriers.",0.075,0.795,0.131,0.7984,0.7842187881469727,0.18649587035179138,0.02928539365530014,1
flight was on time. star alliance members have designated line and boarded after business class. flight attendant offered to place my luggage inside overhead bin! served hot full meal with 2 options even though it was a 3 hour flight. the pork with rice was actually tasty. pillow and blanket were provided even for economy class. attentive and polite service. highly recommend.,0.0,0.949,0.051,0.474,0.002924236236140132,0.040330734103918076,0.9567449688911438,5
"I'd heard many good things about Singapore Airlines so was looking forward to travelling with them but was sadly disappointed. We flew economy in a 777 and although we paid for extra leg room it still felt very cramped. The seat was so uncomfortable, the noisyest flight I can recall ment there was no chance of being able to grab a couple of hours sleep but the worst thing for me was the entertainment screen was not working despite 2 resets I was left staring at the bulkhead for 13 and a half hours. The lead stewardess took my E mail address and promised compensation for the broken screen but a week on an I've heard nothing from them. Hardly one of the world's best airlines I'm afraid.",0.165,0.721,0.114,-0.8689,0.8640711307525635,0.11298392713069916,0.022944917902350426,3
"Paid for a Premium Economy ticket,  an extra $1000 per ticket. Narrow seats only wider armrest. Footrest not supportive and very uncomfortable during trip. 
To top it of they put us in economy from Singapore to Hanoi Vietnam.
No lounge for Premium Economy, only Business class.
Overall would not recommend the extra cost.",0.157,0.812,0.031,-0.7423,0.8902251720428467,0.09818454831838608,0.011590258218348026,2
Flight SQ 241 - I was treated so rudely by the flight staff when we landed in Singapore. I had booked wheelchair assistance for my 76 year old dad has acute asthma and hip problems and my 73 year old mum with both knee replacements. I was told I need to walk to the buggy area as there didn’t have the staff to assist with the wheelchair. My dad ended up having an asthma attack and my both my parents were distress with high blood pressure. After such a long day for Dehli to Singapore we had to catch a flight to Sydney with two unwell highly distressed parent where no one cared to give them wheelchairs or any empathy. I am utterly disgusted with the way I was spoken to by the flight crew (a guy - I don’t remember his name) however the ground staff was not very helpful either.,0.168,0.814,0.017,-0.9728,0.9558578133583069,0.039357054978609085,0.004785091616213322,1
"I booked a round ticket from singapore airlines. I Got the ticket date mixed up so I needed to change the date for return but thought of cancelling the ticket and rebooking it. Got my ticket cancelled online now the problem arises, ticket said it would only cost me $390 to cancel the ticket but charged me $440. When I raised the issue to the Singapore airlines customer service they would say it is actually $440, I  argued about their policy with them and told them I still have cancelled ticket with cancelling fee written on it. Then the customer service apologise for the inconvenience and took my details. Now here is the funny part they told me they would call me but guess what ? got no calls or email regarding the issue. At this point I give up. I know it's only $50 but it's about the honesty of the company. They say something and do another thing. What a bunch of bull people running the business. Either be clear with your policy and mention the right amount or don't bull people about escalating the issue to the senior and never call back. Customer service as it's worst. Never recommend anyone to book ticket from Singapore airlines and cancel it. They will rip you off.",0.156,0.782,0.062,-0.9629,0.8975569605827332,0.09306256473064423,0.00938046257942915,1
"Although flying with Singapore Airlines is comfortable and convenient, we would like to mention that their staff are what makes them exceptional. 
We had a difficult situation and they handled it with patience, kindness and effectiveness. They didn't stop until they found a solution. We want to thank to the staff in general but very much in particular to Thuong and Hang, from the ground staff (Hanoi). Thank you very much! We will definitely use Singapore service whenever possible in the future. You got two new loyal customers!",0.017,0.749,0.234,0.9564,0.002169102430343628,0.017530756071209908,0.9803001880645752,5
